{
  "$schema": "https://paperandslate.org/schemas/eom/1.0/module-registry.schema.json",
  "specification": "https://paperandslate.org/spec/eom/1.0",
  "version": "1.0",
  "id": "https://paperandslate.org/eom/registries/modules/1.0",
  "canonical": "https://paperandslate.org/eom/registries/modules/1.0",
  "type": "module-registry",
  "status": "working-draft",
  "changeController": "https://paperandslate.org/governance/eom",
  "lastReviewed": "2026-08-25",
  "modules": [
    {
      "shortName": "organization",
      "moduleUri": "https://paperandslate.org/eom/modules/organization",
      "title": "Organization",
      "description": "Public identity and profile for an educational organization.",
      "resourceType": "organization-profile",
      "currentVersion": "1.0",
      "compatibleProtocolVersions": ["1.0"],
      "status": "working-draft",
      "changeController": "https://paperandslate.org/governance/eom",
      "schema": "https://paperandslate.org/schemas/eom/1.0/organization-profile.schema.json",
      "privacyClass": "public-reviewed",
      "freshness": "days",
      "collection": "single",
      "example": "examples/minimal-school/public/eom/organization.json",
      "conformanceProfile": "https://paperandslate.org/spec/eom/1.0/profiles/module",
      "extensionPoints": ["https://paperandslate.org/eom/extensions/"],
      "mappings": ["schema.org/Organization"],
      "lastReviewed": "2026-08-26"
    },
    {
      "shortName": "campuses",
      "moduleUri": "https://paperandslate.org/eom/modules/campuses",
      "title": "Campuses",
      "description": "Public campuses and locations served by an organization.",
      "resourceType": "campus-catalog",
      "currentVersion": "1.0",
      "compatibleProtocolVersions": ["1.0"],
      "status": "working-draft",
      "changeController": "https://paperandslate.org/governance/eom",
      "schema": "https://paperandslate.org/schemas/eom/1.0/modules/campus-catalog.schema.json",
      "privacyClass": "public-reviewed",
      "freshness": "days",
      "collection": "items",
      "example": "examples/ecme-high/public/eom/campuses.json",
      "conformanceProfile": "https://paperandslate.org/spec/eom/1.0/profiles/module",
      "extensionPoints": ["https://paperandslate.org/eom/extensions/"],
      "mappings": ["schema.org/Place"],
      "lastReviewed": "2026-08-26"
    },
    {
      "shortName": "departments",
      "moduleUri": "https://paperandslate.org/eom/modules/departments",
      "title": "Departments",
      "description": "Public organizational departments and their relationships.",
      "resourceType": "department-catalog",
      "currentVersion": "1.0",
      "compatibleProtocolVersions": ["1.0"],
      "status": "working-draft",
      "changeController": "https://paperandslate.org/governance/eom",
      "schema": "https://paperandslate.org/schemas/eom/1.0/modules/department-catalog.schema.json",
      "privacyClass": "public-reviewed",
      "freshness": "days",
      "collection": "items",
      "example": "examples/ecme-high/public/eom/departments.json",
      "conformanceProfile": "https://paperandslate.org/spec/eom/1.0/profiles/module",
      "extensionPoints": ["https://paperandslate.org/eom/extensions/"],
      "mappings": ["schema.org/Organization"],
      "lastReviewed": "2026-08-26"
    },
    {
      "shortName": "staff",
      "moduleUri": "https://paperandslate.org/eom/modules/staff",
      "title": "Staff",
      "description": "Deliberately published public staff roles and profiles.",
      "resourceType": "staff-directory",
      "currentVersion": "1.0",
      "compatibleProtocolVersions": ["1.0"],
      "status": "working-draft",
      "changeController": "https://paperandslate.org/governance/eom",
      "schema": "https://paperandslate.org/schemas/eom/1.0/modules/staff-directory.schema.json",
      "privacyClass": "personal-public",
      "freshness": "days",
      "collection": "items",
      "example": "examples/ecme-high/public/eom/staff.json",
      "conformanceProfile": "https://paperandslate.org/spec/eom/1.0/profiles/module",
      "extensionPoints": ["https://paperandslate.org/eom/extensions/"],
      "mappings": ["schema.org/Person"],
      "lastReviewed": "2026-08-26"
    },
    {
      "shortName": "contacts",
      "moduleUri": "https://paperandslate.org/eom/modules/contacts",
      "title": "Contacts",
      "description": "Public role-based and deliberately published contact points.",
      "resourceType": "contact-directory",
      "currentVersion": "1.0",
      "compatibleProtocolVersions": ["1.0"],
      "status": "working-draft",
      "changeController": "https://paperandslate.org/governance/eom",
      "schema": "https://paperandslate.org/schemas/eom/1.0/contact-directory.schema.json",
      "privacyClass": "personal-public",
      "freshness": "days",
      "collection": "items",
      "example": "examples/minimal-school/public/eom/contacts.json",
      "conformanceProfile": "https://paperandslate.org/spec/eom/1.0/profiles/module",
      "extensionPoints": ["https://paperandslate.org/eom/extensions/"],
      "mappings": ["schema.org/ContactPoint"],
      "lastReviewed": "2026-08-26"
    },
    {
      "shortName": "courses",
      "moduleUri": "https://paperandslate.org/eom/modules/courses",
      "title": "Courses",
      "description": "Reusable course definitions with optional international metadata.",
      "resourceType": "course-catalog",
      "currentVersion": "1.0",
      "compatibleProtocolVersions": ["1.0"],
      "status": "working-draft",
      "changeController": "https://paperandslate.org/governance/eom",
      "schema": "https://paperandslate.org/schemas/eom/1.0/modules/course-catalog.schema.json",
      "privacyClass": "public-reviewed",
      "freshness": "days",
      "collection": "items",
      "example": "examples/ecme-high/public/eom/courses.json",
      "conformanceProfile": "https://paperandslate.org/spec/eom/1.0/profiles/module",
      "extensionPoints": ["https://paperandslate.org/eom/extensions/"],
      "mappings": ["schema.org/Course"],
      "lastReviewed": "2026-08-26"
    },
    {
      "shortName": "offerings",
      "moduleUri": "https://paperandslate.org/eom/modules/offerings",
      "title": "Course offerings and sections",
      "description": "Time, location, instructor, and availability-specific course offerings.",
      "resourceType": "course-offering-catalog",
      "currentVersion": "1.0",
      "compatibleProtocolVersions": ["1.0"],
      "status": "working-draft",
      "changeController": "https://paperandslate.org/governance/eom",
      "schema": "https://paperandslate.org/schemas/eom/1.0/modules/course-offering-catalog.schema.json",
      "privacyClass": "public-reviewed",
      "freshness": "hours/days",
      "collection": "items",
      "example": "examples/ecme-high/public/eom/offerings.json",
      "conformanceProfile": "https://paperandslate.org/spec/eom/1.0/profiles/module",
      "extensionPoints": ["https://paperandslate.org/eom/extensions/"],
      "mappings": ["schema.org/CourseInstance"],
      "lastReviewed": "2026-08-26"
    },
    {
      "shortName": "programs",
      "moduleUri": "https://paperandslate.org/eom/modules/programs",
      "title": "Programs and pathways",
      "description": "Public programs, pathways, ordered learning, and credentials.",
      "resourceType": "program-catalog",
      "currentVersion": "1.0",
      "compatibleProtocolVersions": ["1.0"],
      "status": "working-draft",
      "changeController": "https://paperandslate.org/governance/eom",
      "schema": "https://paperandslate.org/schemas/eom/1.0/modules/program-catalog.schema.json",
      "privacyClass": "public-reviewed",
      "freshness": "days",
      "collection": "items",
      "example": "examples/ecme-high/public/eom/programs.json",
      "conformanceProfile": "https://paperandslate.org/spec/eom/1.0/profiles/module",
      "extensionPoints": ["https://paperandslate.org/eom/extensions/"],
      "mappings": ["schema.org/EducationalOccupationalProgram"],
      "lastReviewed": "2026-08-26"
    },
    {
      "shortName": "calendar",
      "moduleUri": "https://paperandslate.org/eom/modules/calendar",
      "title": "Academic calendar",
      "description": "Public academic periods, dates, recurrence, and exceptions.",
      "resourceType": "academic-calendar",
      "currentVersion": "1.0",
      "compatibleProtocolVersions": ["1.0"],
      "status": "working-draft",
      "changeController": "https://paperandslate.org/governance/eom",
      "schema": "https://paperandslate.org/schemas/eom/1.0/modules/academic-calendar.schema.json",
      "privacyClass": "public",
      "freshness": "hours",
      "collection": "items",
      "example": "examples/ecme-high/public/eom/calendar.json",
      "conformanceProfile": "https://paperandslate.org/spec/eom/1.0/profiles/module",
      "extensionPoints": ["https://paperandslate.org/eom/extensions/"],
      "mappings": ["RFC5545"],
      "lastReviewed": "2026-08-26"
    },
    {
      "shortName": "events",
      "moduleUri": "https://paperandslate.org/eom/modules/events",
      "title": "Events",
      "description": "Public events, venues, audiences, and lifecycle updates.",
      "resourceType": "event-catalog",
      "currentVersion": "1.0",
      "compatibleProtocolVersions": ["1.0"],
      "status": "working-draft",
      "changeController": "https://paperandslate.org/governance/eom",
      "schema": "https://paperandslate.org/schemas/eom/1.0/modules/event-catalog.schema.json",
      "privacyClass": "public",
      "freshness": "minutes/hours",
      "collection": "items",
      "example": "examples/ecme-high/public/eom/events.json",
      "conformanceProfile": "https://paperandslate.org/spec/eom/1.0/profiles/module",
      "extensionPoints": ["https://paperandslate.org/eom/extensions/"],
      "mappings": ["schema.org/Event", "RFC5545"],
      "lastReviewed": "2026-08-26"
    },
    {